{
  "edges": [
    {
      "confidence": "high",
      "evidence_refs": [
        "simulated_v1:bep.jsonl"
      ],
      "from": "runs_efd15c8fc1b784129fb7645c",
      "id": "evaluated_target:runs_efd15c8fc1b784129fb7645c:targets_3a7d039221663f4789b5510f",
      "kind": "evaluated_target",
      "redaction_state": "safe",
      "source_kind": "simulated_v1",
      "to": "targets_3a7d039221663f4789b5510f"
    },
    {
      "confidence": "high",
      "evidence_refs": [
        "simulated_v1:bep.jsonl"
      ],
      "from": "runs_efd15c8fc1b784129fb7645c",
      "id": "evaluated_target:runs_efd15c8fc1b784129fb7645c:targets_5658831dad78d6f0abdbd647",
      "kind": "evaluated_target",
      "redaction_state": "safe",
      "source_kind": "simulated_v1",
      "to": "targets_5658831dad78d6f0abdbd647"
    },
    {
      "confidence": "high",
      "evidence_refs": [
        "simulated_v1:bep.jsonl"
      ],
      "from": "targets_5658831dad78d6f0abdbd647",
      "id": "produced_action:targets_5658831dad78d6f0abdbd647:actions_3c4046b933708a355f13b36f",
      "kind": "produced_action",
      "redaction_state": "safe",
      "source_kind": "simulated_v1",
      "to": "actions_3c4046b933708a355f13b36f"
    },
    {
      "confidence": "high",
      "evidence_refs": [
        "simulated_v1:bep.jsonl"
      ],
      "from": "targets_5658831dad78d6f0abdbd647",
      "id": "produced_action:targets_5658831dad78d6f0abdbd647:actions_7aa091be0bdcc7e1375b3e4f",
      "kind": "produced_action",
      "redaction_state": "safe",
      "source_kind": "simulated_v1",
      "to": "actions_7aa091be0bdcc7e1375b3e4f"
    },
    {
      "confidence": "high",
      "evidence_refs": [
        "simulated_v1:bep.jsonl"
      ],
      "from": "targets_3a7d039221663f4789b5510f",
      "id": "produced_action:targets_3a7d039221663f4789b5510f:actions_e77415194169644835c3225b",
      "kind": "produced_action",
      "redaction_state": "safe",
      "source_kind": "simulated_v1",
      "to": "actions_e77415194169644835c3225b"
    },
    {
      "confidence": "medium",
      "evidence_refs": [
        "simulated_v1:profile.json"
      ],
      "from": "targets_5658831dad78d6f0abdbd647",
      "id": "observed_cache_event:targets_5658831dad78d6f0abdbd647:cache_events_2c5aa3b32b68a25b478d4417",
      "kind": "observed_cache_event",
      "redaction_state": "safe",
      "source_kind": "derived_v1",
      "to": "cache_events_2c5aa3b32b68a25b478d4417"
    },
    {
      "confidence": "high",
      "evidence_refs": [
        "simulated_v1:execution-log.json"
      ],
      "from": "targets_5658831dad78d6f0abdbd647",
      "id": "observed_cache_event:targets_5658831dad78d6f0abdbd647:cache_events_5300f4c95786094dfcb9d7cb",
      "kind": "observed_cache_event",
      "redaction_state": "safe",
      "source_kind": "simulated_v1",
      "to": "cache_events_5300f4c95786094dfcb9d7cb"
    },
    {
      "confidence": "high",
      "evidence_refs": [
        "simulated_v1:execution-log.json"
      ],
      "from": "targets_3a7d039221663f4789b5510f",
      "id": "observed_cache_event:targets_3a7d039221663f4789b5510f:cache_events_cd491628c2ce1a1744045ece",
      "kind": "observed_cache_event",
      "redaction_state": "safe",
      "source_kind": "simulated_v1",
      "to": "cache_events_cd491628c2ce1a1744045ece"
    },
    {
      "confidence": "low",
      "evidence_refs": [
        "simulated_v1:profile.json"
      ],
      "from": "targets_3a7d039221663f4789b5510f",
      "id": "observed_cache_event:targets_3a7d039221663f4789b5510f:cache_events_9aae150c5ae2c4bb9a8203a6",
      "kind": "observed_cache_event",
      "redaction_state": "safe",
      "source_kind": "derived_v1",
      "to": "cache_events_9aae150c5ae2c4bb9a8203a6"
    },
    {
      "confidence": "high",
      "evidence_refs": [
        "simulated_v1:bep.jsonl"
      ],
      "from": "runs_efd15c8fc1b784129fb7645c",
      "id": "observed_failure:runs_efd15c8fc1b784129fb7645c:failures_aacfa7067d451e2284f552f9",
      "kind": "observed_failure",
      "redaction_state": "safe",
      "source_kind": "simulated_v1",
      "to": "failures_aacfa7067d451e2284f552f9"
    },
    {
      "confidence": "high",
      "evidence_refs": [
        "simulated_v1:bep.jsonl"
      ],
      "from": "runs_efd15c8fc1b784129fb7645c",
      "id": "observed_failure:runs_efd15c8fc1b784129fb7645c:failures_d157bd86959f2c75ddde1aef",
      "kind": "observed_failure",
      "redaction_state": "safe",
      "source_kind": "simulated_v1",
      "to": "failures_d157bd86959f2c75ddde1aef"
    }
  ],
  "generated_at": "2026-06-06T21:45:21.733246Z",
  "nodes": [
    {
      "confidence": "high",
      "evidence_refs": [
        "simulated_v1:bep.jsonl",
        "simulated_v1:execution-log.json",
        "simulated_v1:profile.json"
      ],
      "id": "runs_efd15c8fc1b784129fb7645c",
      "kind": "run",
      "label": "fixture-ingest",
      "payload": {
        "mode": "cache-only",
        "run_group": "latest",
        "scenario": "fixture-ingest",
        "status": "ingested"
      },
      "redaction_state": "safe",
      "source_kind": "simulated_v1",
      "status": "ingested"
    },
    {
      "confidence": "high",
      "evidence_refs": [
        "simulated_v1:bep.jsonl"
      ],
      "id": "targets_3a7d039221663f4789b5510f",
      "kind": "target",
      "label": "//tasks:flaky_test",
      "payload": {
        "label": "//tasks:flaky_test",
        "run_id": "runs_efd15c8fc1b784129fb7645c",
        "status": "FAILED",
        "target_kind": "py_test rule"
      },
      "redaction_state": "safe",
      "source_kind": "simulated_v1",
      "status": "FAILED"
    },
    {
      "confidence": "high",
      "evidence_refs": [
        "simulated_v1:bep.jsonl"
      ],
      "id": "targets_5658831dad78d6f0abdbd647",
      "kind": "target",
      "label": "//tasks:priority_test",
      "payload": {
        "label": "//tasks:priority_test",
        "run_id": "runs_efd15c8fc1b784129fb7645c",
        "status": "PASSED",
        "target_kind": "py_test rule"
      },
      "redaction_state": "safe",
      "source_kind": "simulated_v1",
      "status": "PASSED"
    },
    {
      "confidence": "high",
      "evidence_refs": [
        "simulated_v1:bep.jsonl"
      ],
      "id": "actions_3c4046b933708a355f13b36f",
      "kind": "action",
      "label": "BazelTest",
      "payload": {
        "action_key": "//tasks:priority_test:test:run=1:shard=1:attempt=1",
        "mnemonic": "BazelTest",
        "run_id": "runs_efd15c8fc1b784129fb7645c",
        "status": "PASSED",
        "target_id": "targets_5658831dad78d6f0abdbd647"
      },
      "redaction_state": "safe",
      "source_kind": "simulated_v1",
      "status": "PASSED"
    },
    {
      "confidence": "high",
      "evidence_refs": [
        "simulated_v1:bep.jsonl"
      ],
      "id": "actions_7aa091be0bdcc7e1375b3e4f",
      "kind": "action",
      "label": "PythonTestSetup",
      "payload": {
        "action_key": "//tasks:priority_test:action:1",
        "mnemonic": "PythonTestSetup",
        "run_id": "runs_efd15c8fc1b784129fb7645c",
        "status": "SUCCESS",
        "target_id": "targets_5658831dad78d6f0abdbd647"
      },
      "redaction_state": "safe",
      "source_kind": "simulated_v1",
      "status": "SUCCESS"
    },
    {
      "confidence": "high",
      "evidence_refs": [
        "simulated_v1:bep.jsonl"
      ],
      "id": "actions_e77415194169644835c3225b",
      "kind": "action",
      "label": "BazelTest",
      "payload": {
        "action_key": "//tasks:flaky_test:test:run=1:shard=1:attempt=1",
        "mnemonic": "BazelTest",
        "run_id": "runs_efd15c8fc1b784129fb7645c",
        "status": "FAILED",
        "target_id": "targets_3a7d039221663f4789b5510f"
      },
      "redaction_state": "safe",
      "source_kind": "simulated_v1",
      "status": "FAILED"
    },
    {
      "confidence": "medium",
      "evidence_refs": [
        "simulated_v1:profile.json"
      ],
      "id": "cache_events_2c5aa3b32b68a25b478d4417",
      "kind": "cache_event",
      "label": "remote_cache_hit",
      "payload": {
        "digest": "sha256:1111222233334444",
        "event_key": "profile://tasks:priority_test:PyTest:sha256:1111222233334444",
        "event_kind": "remote_cache_hit",
        "hit": 1,
        "run_id": "runs_efd15c8fc1b784129fb7645c",
        "target_id": "targets_5658831dad78d6f0abdbd647"
      },
      "redaction_state": "safe",
      "source_kind": "derived_v1",
      "status": null
    },
    {
      "confidence": "high",
      "evidence_refs": [
        "simulated_v1:execution-log.json"
      ],
      "id": "cache_events_5300f4c95786094dfcb9d7cb",
      "kind": "cache_event",
      "label": "remote_cache_hit",
      "payload": {
        "digest": "sha256:1111222233334444",
        "event_key": "//tasks:priority_test:PyTest:sha256:1111222233334444",
        "event_kind": "remote_cache_hit",
        "hit": 1,
        "run_id": "runs_efd15c8fc1b784129fb7645c",
        "target_id": "targets_5658831dad78d6f0abdbd647"
      },
      "redaction_state": "safe",
      "source_kind": "simulated_v1",
      "status": null
    },
    {
      "confidence": "high",
      "evidence_refs": [
        "simulated_v1:execution-log.json"
      ],
      "id": "cache_events_cd491628c2ce1a1744045ece",
      "kind": "cache_event",
      "label": "cache_miss",
      "payload": {
        "digest": "sha256:aaaabbbbccccdddd",
        "event_key": "//tasks:flaky_test:PyTest:sha256:aaaabbbbccccdddd",
        "event_kind": "cache_miss",
        "hit": 0,
        "run_id": "runs_efd15c8fc1b784129fb7645c",
        "target_id": "targets_3a7d039221663f4789b5510f"
      },
      "redaction_state": "safe",
      "source_kind": "simulated_v1",
      "status": null
    },
    {
      "confidence": "low",
      "evidence_refs": [
        "simulated_v1:profile.json"
      ],
      "id": "cache_events_9aae150c5ae2c4bb9a8203a6",
      "kind": "cache_event",